Video ID,Title,Description,Published At
Ld0EtmRU5Eg,SSJ Twiin - Thief The Night Away (bandlab ad) - (Lyrics),,2024-06-08T23:15:08Z
Zf4KMJaf4j4,Thieves Like Us - Headlong Into Night • Karaoke,,2024-05-21T08:27:54Z
ratirTTc2zU,&#39;Thief in the Night&#39;| Impressive Grace,Impressive Grace is an Adventist Singing Ministry group from the Niutenabuti Seventh-day Adventist Church in Guadalcanal.,2023-11-20T21:37:28Z
bp5KBfN6Muk,"VLOG | Emo Night Karaoke With Nights Like Thieves 9/21/23-(San Diego, CA) #poppunk #oceanbeach",,2023-09-23T01:40:25Z
WWCk0LM1wqw,Karaoke Night [SEA OF THIEVES] Season 9,Karaoke Night [SEA OF THIEVES] Season 9 This is why you must use a microphone while playing Sea of Thieves Season 9 ...,2023-03-18T16:57:07Z
WWCk0LM1wqw,Karaoke Night [SEA OF THIEVES] Season 9,Karaoke Night [SEA OF THIEVES] Season 9 This is why you must use a microphone while playing Sea of Thieves Season 9 ...,2023-03-18T16:57:07Z
fZFTzLu7IXQ,Karaoke Night! | Singing &quot;Soda&quot; by Nothing but Thieves,Usually I only sang some parts of a song 'cause I don't have much confidence that I'll do well singing a full song. I have recorded ...,2022-12-11T01:50:52Z
HO3nxoscFOY,Summer Thieves - Saturday Night [Official Video],"From the album Paradise Down The Road, out now - https://ffm.to/pdtr Director: Steffen Taylor & Raymond Tuifao Lalotoa ...",2022-02-10T06:27:12Z
58V490y1S58,FIRST TIME LISTENING TO Black Star - Thieves In The Night | 90s HIP HOP REACTION,This is my reaction to Black Star - Thieves In The Night ▭▭▭▭▭▭▭▭▭▭▭▭▭▭▭▭▭▭▭▭▭▭▭ REACTION REQUEST ...,2021-12-06T01:17:33Z
Nr0SqIAFohk,Wolfmother - Joker And The Thief (Audio),"Official remix audio for 'Joker And The Thief' by Wolfmother. Download, Buy or Stream 'Joker And The Thief' by Wolfmother here: ...",2021-10-08T13:00:10Z
6gyDlzASal0,Thief In The Night (Live),Provided to YouTube by Universal Music Group Thief In The Night (Live) · Influence Music · Melody Noel ages ℗ 2021 Influence ...,2021-06-03T10:07:36Z
RT4Xc4RKT34,BLACKSTAR - THIEVES IN THE NIGHT [ REACTION ] IM JUST HERE FOR HIM...,old school swag...blackstar - thieves in the night reaction. mos def and talib kweli team up. If you want me to react to a song or ...,2020-08-09T18:23:43Z
6sPPn4z4cZc,Phantom Thieves Karaoke Night (It&#39;s Dark fanmade MV),"Song by GHOST, Aria, Ponko, and Umber. Characters by ATLUS. Art and (terrible) video by Strink Family. Sorry I haven't ...",2020-04-15T17:29:26Z
4mufKgPfS6E,Like A Thief In The Night Instrumental,"Provided to YouTube by Routenote Like A Thief In The Night Instrumental · Frank Austin First Composition ℗ 8 September, 2013 ...",2020-03-25T16:07:26Z
jbvZNR9EvJo,STRANGERS IN THE NIGHT. Sixty Thieves &amp; Edward Robert. Cover karaoke en dúo.,Creado con Smule: https://www.smule.com.,2019-09-10T07:47:43Z
SVUTjdeVsqg,Thief in the night - Rolling Stones (SUBTITULADO) - Bremen Alemania 1998,Thief in the night un himno indiscutido del gran Keith Richards! con Leah Wood como invitada en los coros (hija de Ronnie Wood),2019-08-24T02:28:25Z
pD-fpSS_o1k,Asylum &quot;Thief In The Night&quot; (Karaoke Version),"""Thief In The Night"" karaoke version by Asylum ©2003 Atlantis CDS, LLC. Available at www.atlantiscds.com , iTunes, Google ...",2019-06-17T21:23:08Z
WEGguqFLUgQ,KARAOKE NIGHT 🎤!! XD!!! Uncharted 4: A thieves End,,2017-06-23T02:43:52Z
uwjLujdZ2AM,Hot Chip - Thieves in the Night Lyrics,[Lyrics Hot Chip - Thieves in the Night] My friend once told me something so right He said to be careful of thieves in the night Baby ...,2016-11-22T20:59:42Z
LfiwevvisOk,Blackstar - Thieves In The Night (Instrumental),,2011-06-24T18:37:28Z
H9kBOl36XM8,Thieves in the Night &quot;Roadhouse Blues&quot;,Blues Rock.,2011-05-29T17:49:22Z
eSQwUOQoTmE,Thieves in the Night  SingSnap Original by ThelmaHarper2.flv,Thieves in the Night copyright Debi 1979.,2010-02-07T03:14:06Z
r5dk1P_638s,Thieves in the Night with Lyrics,I do NOT own this content! Thieves in the Night by Black Star with lyrics. Mos Def & Talib Kweli Are Black Star © 2002 Rawkus ...,2009-09-25T15:42:17Z
